{
  "schema_version": 1,
  "run_id": "20261011-103154-ac03d1",
  "gap_id": "GAP-005",
  "findings": [
    {"id": "F-GAP-005-01", "gap_id": "GAP-005", "claim": "The source advises asking for confirmation before an action that cannot be undone, and stating the consequence in the dialog text, for example which package will be awarded and to whom.",
     "source_id": "SRC-c52222b5", "snippet": "Ask for confirmation before an action that cannot be undone, and state the consequence in the dialog text, for example which package will be awarded and to whom.",
     "how_source_supports": "The sentence directly recommends a confirmation for irreversible actions and names the package and the recipient of the award as the information to display.",
     "recommendation": {"text": "Add a confirmation step before Award Package is committed, whose text names the package and the supplier being awarded.", "rationale": "The source recommends this for irreversible actions and DEC-002 makes awards irreversible. Whether to also show value or other details is not covered by the source."},
     "source_type": "other", "publication_date": null,
     "confidence": {"level": "low", "explanation": "The source is a test fixture, not real documentation, and is not GOV.UK or Nielsen Norman Group guidance."},
     "limitations": ["The page states it is a test fixture and not real documentation.", "It does not mention the supplier value, note or quote, only package and recipient.", "No publication date available."], "needs_confirmation": true,
     "provenance": "research_evidence", "kind": "recommendation"},
    {"id": "F-GAP-005-02", "gap_id": "GAP-005", "claim": "The source advises labelling the confirm button with the action itself, such as Award package, rather than a generic OK.",
     "source_id": "SRC-c52222b5", "snippet": "Label the confirm button with the action itself, such as Award package, rather than a generic OK.",
     "how_source_supports": "The sentence states the button labelling guidance and uses an award as its example.",
     "recommendation": null,
     "source_type": "other", "publication_date": null,
     "confidence": {"level": "low", "explanation": "The source is a test fixture, not real documentation."},
     "limitations": ["The page states it is a test fixture and not real documentation."], "needs_confirmation": false,
     "provenance": "research_evidence", "kind": "finding"},
    {"id": "F-GAP-005-03", "gap_id": "GAP-005", "claim": "The source advises not asking for confirmation of actions that can be undone easily, and offering undo instead.",
     "source_id": "SRC-c52222b5", "snippet": "Do not ask for confirmation of actions that can be undone easily; offer undo instead.",
     "how_source_supports": "It distinguishes easily undone actions from irreversible ones. Awards are irreversible per DEC-002, so confirmation rather than undo would apply.",
     "recommendation": null,
     "source_type": "other", "publication_date": null,
     "confidence": {"level": "low", "explanation": "The source is a test fixture, not real documentation."},
     "limitations": ["The page states it is a test fixture and not real documentation."], "needs_confirmation": false,
     "provenance": "research_evidence", "kind": "finding"},
    {"id": "F-GAP-005-04", "gap_id": "GAP-005", "claim": "If the award confirmation is a modal dialog, the source advises moving focus to the first focusable element, or to the dialog heading when the first control is destructive, keeping focus inside while open, and returning it to the opening control on close.",
     "source_id": "SRC-254f3248", "snippet": "When a modal dialog opens, move keyboard focus to the first focusable element inside the dialog, or to the dialog heading when the first control is destructive.",
     "how_source_supports": "The sentence sets the initial focus rule for modal dialogs, including when the first control is destructive. The following lines of the source cover keeping and returning focus.",
     "recommendation": null,
     "source_type": "official_documentation", "publication_date": null,
     "confidence": {"level": "low", "explanation": "The source is a test fixture, not real documentation."},
     "limitations": ["The page states it is a test fixture and not real documentation.", "Applies only if the confirmation is implemented as a modal dialog."], "needs_confirmation": false,
     "provenance": "research_evidence", "kind": "finding"}
  ],
  "unanswered_questions": [
    {"question": "What do GOV.UK Design System or Nielsen Norman Group recommend for confirming irreversible actions?", "why_unanswered": "Live search was unavailable (fixture mode); only fixture pages were available, and these are not those organisations' guidance."},
    {"question": "What information should a confirmation for committing a contract award to a supplier display?", "why_unanswered": "The only source mentions package and supplier; no source covers contract value, quote reference or award note."}
  ],
  "disagreements": [],
  "proposed_status_changes": []
}
