{
  "schema_version": 1,
  "run_id": "20261011-120000-abcdef",
  "gap_id": "GAP-002",
  "findings": [
    {
      "id": "F-GAP-002-01",
      "gap_id": "GAP-002",
      "claim": "When a modal dialog opens, focus moves to an element inside the dialog.",
      "source_id": "SRC-aaaa0001",
      "snippet": "When a dialog opens, focus moves to an element inside the dialog.",
      "how_source_supports": "States the rule.",
      "recommendation": null,
      "source_type": "standard",
      "publication_date": null,
      "confidence": {
        "level": "high",
        "explanation": "Standard"
      },
      "limitations": [],
      "needs_confirmation": false,
      "provenance": "research_evidence",
      "kind": "finding"
    },
    {
      "id": "F-GAP-002-02",
      "gap_id": "GAP-002",
      "claim": "Focus returns within 200 ms.",
      "source_id": "SRC-aaaa0001",
      "snippet": "When a dialog closes, focus returns to the element that invoked the dialog",
      "how_source_supports": "x",
      "recommendation": {
        "text": "Return focus within 200 ms.",
        "rationale": "x"
      },
      "source_type": "standard",
      "publication_date": null,
      "confidence": {
        "level": "low",
        "explanation": "x"
      },
      "limitations": [],
      "needs_confirmation": false,
      "provenance": "research_evidence",
      "kind": "recommendation"
    }
  ],
  "unanswered_questions": [],
  "disagreements": [],
  "proposed_status_changes": []
}